pin_id,article_slug,article_title,category,category_slug,board_name,board_slug,pin_variant,pin_title,pin_description,keywords,alt_text,destination_url,image_file,image_url,image_prompt,overlay_top,overlay_center,overlay_bottom,overlay_style,composition,visual_focus,quality_rules,compliance_notes,quality_status,quality_rejection_reasons,quality_rule_key,quality_rule_label,quality_score,source_signature,quality_source_id,quality_source_key,quality_source_type,quality_source_url,quality_source_text,quality_checked_at
front-yard-rock-and-mulch-landscaping-a,front-yard-rock-and-mulch-landscaping,Front Yard Rock and Mulch Landscaping Ideas,Front Yard Landscaping With Rocks,front-yard-landscaping-with-rocks,Front Yard Landscaping With Rocks,front-yard-landscaping-with-rocks,A,Rock and Mulch Landscaping Ideas: Hero Curb Appeal View,"See the full-property view for Front Yard Rock and Mulch Landscaping Ideas: fresh mulch beds, rocks, gravel, boulders, real American curb appeal, natural light, and practical front yard landscaping ideas. Rock and Mulch Landscaping Ideas with mixing soft mulch with stone texture, realistic photography, and polished Pinterest-ready curb appeal.",Rock Landscaping; rock landscaping; gravel front yard; stone border; boulder landscaping; hero exterior; full property view; curb appeal view; front yard inspiration; front yard landscaping; rock and mulch; curb appeal; Front Yard Landscaping With Rocks; front yard rock mulch landscaping; fresh mulch beds; rocks,"Wide exterior view, hero shot, full property view for Front Yard Rock and Mulch Landscaping Ideas, showing fresh mulch beds, rocks, gravel around a realistic American home.",https://frontyardaura.com/blog/front-yard-rock-and-mulch-landscaping/,front-yard-rock-and-mulch-landscaping-pin-a-m5cey.jpg,https://frontyardaura.com/pins/front-yard-rock-and-mulch-landscaping-pin-a-m5cey.jpg,"Ultra realistic photorealistic DSLR vertical 2:3 Pinterest image, 1000x1500 composition, professional architectural photography of a real American home. Article match: ""Front Yard Rock and Mulch Landscaping Ideas"" in ""Front Yard Landscaping With Rocks"", slug concept ""front yard rock mulch landscaping"", keywords ""front yard landscaping, rock and mulch, curb appeal"". Scene: wide street-level architectural hero photograph showing the full property, driveway edge, walkway, porch, and complete landscape layout; this must read as a broad exterior establishing shot. The image must immediately communicate Rock Landscaping and must visibly include fresh mulch beds, rocks, gravel, boulders, stone borders, real stone texture. Use natural daylight, believable American suburban architecture, real landscaping, real plant scale, authentic stone/soil/mulch/flower textures, magazine-quality curb appeal, no staged showroom look. Reserve clean readable negative space for a later overlay without covering the main landscaping subject; keep the most important yard feature away from the center title zone and bottom CTA zone. Do not render text into the base photo; add the overlay in post-production using the overlay fields.",FRONT YARD AURA,Front Yard Rock and Mulch Landscaping Ideas,Must-See Stone Ideas,"Premium Pinterest typography with strict mobile-safe layout: title max width 820px, 90px side padding, automatic font sizing, controlled line wrapping, and no text overflow outside the image. Use a light readability treatment only: subtle shadow, soft local panel behind title, and reduced dark overlay so the photo stays bright. Keep title and CTA inside safe margins and away from the core landscape detail. center title over calm sky, lawn, or facade negative space","Wide exterior view, hero shot, full property view","full American home exterior, front yard, entry path, foundation beds, street-facing curb appeal",Ultra realistic; photorealistic; DSLR photography; natural lighting; real American homes; real landscaping; real textures; professional architectural photography; Pinterest worthy; magazine quality.,Candidate only. Do not publish until scripts/generate-production-pins.mjs assigns quality_status=approved after strict image-source filtering.,approved,,rock-landscaping,"Rocks, boulders, or gravel visible",83,unsplash:photo-1682967921102-597a206738d5,photo-1682967921102-597a206738d5,photo 1682967921102 597a206738d5,unsplash-expanded-search,https://images.unsplash.com/photo-1682967921102-597a206738d5,a stone path leading to a large house a stone path leading to a large house xn7jby ipni a stone path leading to a large house a stone path leading to a large house xn7jby ipni,2026-06-04T18:40:43.410Z
front-yard-rock-border-ideas-a,front-yard-rock-border-ideas,Front Yard Rock Border Ideas,Front Yard Landscaping With Rocks,front-yard-landscaping-with-rocks,Front Yard Landscaping With Rocks,front-yard-landscaping-with-rocks,A,Rock Border Ideas for Front Yards: Hero Curb Appeal View,"See the full-property view for Front Yard Rock Border Ideas: rocks, gravel, boulders, stone borders, real American curb appeal, natural light, and practical front yard landscaping ideas. Rock Border Ideas for Front Yards with stone edges for beds, paths, and curb lines, realistic photography, and polished Pinterest-ready curb appeal.",Rock Landscaping; rock landscaping; gravel front yard; stone border; boulder landscaping; hero exterior; full property view; curb appeal view; front yard inspiration; front yard landscaping; rock borders; curb appeal; Front Yard Landscaping With Rocks; front yard rock border ideas; rocks; gravel,"Wide exterior view, hero shot, full property view for Front Yard Rock Border Ideas, showing rocks, gravel, boulders around a realistic American home.",https://frontyardaura.com/blog/front-yard-rock-border-ideas/,front-yard-rock-border-ideas-pin-a-18evp.jpg,https://frontyardaura.com/pins/front-yard-rock-border-ideas-pin-a-18evp.jpg,"Ultra realistic photorealistic DSLR vertical 2:3 Pinterest image, 1000x1500 composition, professional architectural photography of a real American home. Article match: ""Front Yard Rock Border Ideas"" in ""Front Yard Landscaping With Rocks"", slug concept ""front yard rock border ideas"", keywords ""front yard landscaping, rock borders, curb appeal"". Scene: wide street-level architectural hero photograph showing the full property, driveway edge, walkway, porch, and complete landscape layout; this must read as a broad exterior establishing shot. The image must immediately communicate Rock Landscaping and must visibly include rocks, gravel, boulders, stone borders, real stone texture. Use natural daylight, believable American suburban architecture, real landscaping, real plant scale, authentic stone/soil/mulch/flower textures, magazine-quality curb appeal, no staged showroom look. Reserve clean readable negative space for a later overlay without covering the main landscaping subject; keep the most important yard feature away from the center title zone and bottom CTA zone. Do not render text into the base photo; add the overlay in post-production using the overlay fields.",FRONT YARD AURA,Front Yard Rock Border Ideas,Must-See Stone Ideas,"Premium Pinterest typography with strict mobile-safe layout: title max width 820px, 90px side padding, automatic font sizing, controlled line wrapping, and no text overflow outside the image. Use a light readability treatment only: subtle shadow, soft local panel behind title, and reduced dark overlay so the photo stays bright. Keep title and CTA inside safe margins and away from the core landscape detail. center title over calm sky, lawn, or facade negative space","Wide exterior view, hero shot, full property view","full American home exterior, front yard, entry path, foundation beds, street-facing curb appeal",Ultra realistic; photorealistic; DSLR photography; natural lighting; real American homes; real landscaping; real textures; professional architectural photography; Pinterest worthy; magazine quality.,Candidate only. Do not publish until scripts/generate-production-pins.mjs assigns quality_status=approved after strict image-source filtering.,approved,,rock-landscaping,"Rocks, boulders, or gravel visible",83,unsplash:photo-1659543306077-531660522af2,photo-1659543306077-531660522af2,photo 1659543306077 531660522af2,unsplash-expanded-search,https://images.unsplash.com/photo-1659543306077-531660522af2,a stone path with a house and trees on the side a stone path with a house and trees on the side gtzqsi6aw5e a stone path with a house and trees on the side a stone path with a house and trees on the side gtzqsi6aw5e,2026-06-04T18:52:25.466Z
front-yard-rock-garden-with-flowers-a,front-yard-rock-garden-with-flowers,Front Yard Rock Garden With Flowers,Front Yard Landscaping With Rocks,front-yard-landscaping-with-rocks,Front Yard Landscaping With Rocks,front-yard-landscaping-with-rocks,A,Front Yard Rock Garden With Flowers for Curb Appeal: Hero Curb Appeal View,"See the full-property view for Front Yard Rock Garden With Flowers: rocks, gravel, boulders, stone borders, real American curb appeal, natural light, and practical front yard landscaping ideas. Rock Garden With Flowers with stone texture with soft blooms and seasonal color, realistic photography, and polished Pinterest-ready curb appeal.",Rock Landscaping; rock landscaping; gravel front yard; stone border; boulder landscaping; hero exterior; full property view; curb appeal view; front yard inspiration; front yard landscaping; rock garden flowers; curb appeal; Front Yard Landscaping With Rocks; front yard rock garden flowers; rocks; gravel,"Wide exterior view, hero shot, full property view for Front Yard Rock Garden With Flowers, showing rocks, gravel, boulders around a realistic American home.",https://frontyardaura.com/blog/front-yard-rock-garden-with-flowers/,front-yard-rock-garden-with-flowers-pin-a-1sp7u.jpg,https://frontyardaura.com/pins/front-yard-rock-garden-with-flowers-pin-a-1sp7u.jpg,"Ultra realistic photorealistic DSLR vertical 2:3 Pinterest image, 1000x1500 composition, professional architectural photography of a real American home. Article match: ""Front Yard Rock Garden With Flowers"" in ""Front Yard Landscaping With Rocks"", slug concept ""front yard rock garden flowers"", keywords ""front yard landscaping, rock garden flowers, curb appeal"". Scene: wide street-level architectural hero photograph showing the full property, driveway edge, walkway, porch, and complete landscape layout; this must read as a broad exterior establishing shot. The image must immediately communicate Rock Landscaping and must visibly include rocks, gravel, boulders, stone borders, real stone texture. Use natural daylight, believable American suburban architecture, real landscaping, real plant scale, authentic stone/soil/mulch/flower textures, magazine-quality curb appeal, no staged showroom look. Reserve clean readable negative space for a later overlay without covering the main landscaping subject; keep the most important yard feature away from the center title zone and bottom CTA zone. Do not render text into the base photo; add the overlay in post-production using the overlay fields.",FRONT YARD AURA,Front Yard Rock Garden With Flowers,Must-See Stone Ideas,"Premium Pinterest typography with strict mobile-safe layout: title max width 820px, 90px side padding, automatic font sizing, controlled line wrapping, and no text overflow outside the image. Use a light readability treatment only: subtle shadow, soft local panel behind title, and reduced dark overlay so the photo stays bright. Keep title and CTA inside safe margins and away from the core landscape detail. center title over calm sky, lawn, or facade negative space","Wide exterior view, hero shot, full property view","full American home exterior, front yard, entry path, foundation beds, street-facing curb appeal",Ultra realistic; photorealistic; DSLR photography; natural lighting; real American homes; real landscaping; real textures; professional architectural photography; Pinterest worthy; magazine quality.,Candidate only. Do not publish until scripts/generate-production-pins.mjs assigns quality_status=approved after strict image-source filtering.,approved,,flower-bed,Flower bed or flowers visible,84,unsplash:photo-1709605390663-69cca089ecd0,photo-1709605390663-69cca089ecd0,photo 1709605390663 69cca089ecd0,unsplash-search,https://images.unsplash.com/photo-1709605390663-69cca089ecd0,a large house with a lot of flowers in front of it a large house with a lot of flowers in front of it pvngl6rvvxm a large house with a lot of flowers in front of it a large house with a lot of flowers in front of it pvngl6rvvxm,2026-06-03T15:51:32.843Z
front-yard-rock-landscaping-around-trees-a,front-yard-rock-landscaping-around-trees,Front Yard Rock Landscaping Around Trees,Front Yard Landscaping With Rocks,front-yard-landscaping-with-rocks,Front Yard Landscaping With Rocks,front-yard-landscaping-with-rocks,A,Rock Landscaping Around Trees: Hero Curb Appeal View,"See the full-property view for Front Yard Rock Landscaping Around Trees: rocks, gravel, boulders, stone borders, real American curb appeal, natural light, and practical front yard landscaping ideas. Rock Landscaping Around Trees with tree bases, stone rings, and clean maintenance, realistic photography, and polished Pinterest-ready curb appeal.",Rock Landscaping; rock landscaping; gravel front yard; stone border; boulder landscaping; hero exterior; full property view; curb appeal view; front yard inspiration; front yard landscaping; rock around trees; curb appeal; Front Yard Landscaping With Rocks; front yard rock landscaping around trees; rocks; gravel,"Wide exterior view, hero shot, full property view for Front Yard Rock Landscaping Around Trees, showing rocks, gravel, boulders around a realistic American home.",https://frontyardaura.com/blog/front-yard-rock-landscaping-around-trees/,front-yard-rock-landscaping-around-trees-pin-a-14b6p.jpg,https://frontyardaura.com/pins/front-yard-rock-landscaping-around-trees-pin-a-14b6p.jpg,"Ultra realistic photorealistic DSLR vertical 2:3 Pinterest image, 1000x1500 composition, professional architectural photography of a real American home. Article match: ""Front Yard Rock Landscaping Around Trees"" in ""Front Yard Landscaping With Rocks"", slug concept ""front yard rock landscaping around trees"", keywords ""front yard landscaping, rock around trees, curb appeal"". Scene: wide street-level architectural hero photograph showing the full property, driveway edge, walkway, porch, and complete landscape layout; this must read as a broad exterior establishing shot. The image must immediately communicate Rock Landscaping and must visibly include rocks, gravel, boulders, stone borders, real stone texture. Use natural daylight, believable American suburban architecture, real landscaping, real plant scale, authentic stone/soil/mulch/flower textures, magazine-quality curb appeal, no staged showroom look. Reserve clean readable negative space for a later overlay without covering the main landscaping subject; keep the most important yard feature away from the center title zone and bottom CTA zone. Do not render text into the base photo; add the overlay in post-production using the overlay fields.",FRONT YARD AURA,Front Yard Rock Landscaping Around Trees,Must-See Stone Ideas,"Premium Pinterest typography with strict mobile-safe layout: title max width 820px, 90px side padding, automatic font sizing, controlled line wrapping, and no text overflow outside the image. Use a light readability treatment only: subtle shadow, soft local panel behind title, and reduced dark overlay so the photo stays bright. Keep title and CTA inside safe margins and away from the core landscape detail. center title over calm sky, lawn, or facade negative space","Wide exterior view, hero shot, full property view","full American home exterior, front yard, entry path, foundation beds, street-facing curb appeal",Ultra realistic; photorealistic; DSLR photography; natural lighting; real American homes; real landscaping; real textures; professional architectural photography; Pinterest worthy; magazine quality.,Candidate only. Do not publish until scripts/generate-production-pins.mjs assigns quality_status=approved after strict image-source filtering.,approved,,rock-landscaping,"Rocks, boulders, or gravel visible",83,unsplash:photo-1559719882-e2cf6153c67f,photo-1559719882-e2cf6153c67f,photo 1559719882 e2cf6153c67f,unsplash-expanded-search,https://images.unsplash.com/photo-1559719882-e2cf6153c67f,a stone path in front of a house a stone path in front of a house daxydjzkepi a stone path in front of a house a stone path in front of a house daxydjzkepi,2026-06-04T18:52:25.466Z
front-yard-rock-landscaping-for-brick-houses-a,front-yard-rock-landscaping-for-brick-houses,Front Yard Rock Landscaping for Brick Houses,Front Yard Landscaping With Rocks,front-yard-landscaping-with-rocks,Front Yard Landscaping With Rocks,front-yard-landscaping-with-rocks,A,Front Yard Rock Landscaping for Brick Houses: Hero Curb Appeal View,"See the full-property view for Front Yard Rock Landscaping for Brick Houses: brick walkway or edging, rocks, gravel, boulders, real American curb appeal, natural light, and practical front yard landscaping ideas. Front Yard Rock Landscaping for Brick Houses with warm masonry, grounded stone, and balanced planting, natural light, and a polished Pinterest-ready look.",Rock Landscaping; rock landscaping; gravel front yard; stone border; boulder landscaping; hero exterior; full property view; curb appeal view; front yard inspiration; front yard landscaping; rock landscaping for brick homes; curb appeal; Front Yard Landscaping With Rocks; front yard rock landscaping brick houses; brick walkway or edging; rocks,"Wide exterior view, hero shot, full property view for Front Yard Rock Landscaping for Brick Houses, showing brick walkway or edging, rocks, gravel around a realistic American home.",https://frontyardaura.com/blog/front-yard-rock-landscaping-for-brick-houses/,front-yard-rock-landscaping-for-brick-houses-pin-a-63pm3.jpg,https://frontyardaura.com/pins/front-yard-rock-landscaping-for-brick-houses-pin-a-63pm3.jpg,"Ultra realistic photorealistic DSLR vertical 2:3 Pinterest image, 1000x1500 composition, professional architectural photography of a real American home. Article match: ""Front Yard Rock Landscaping for Brick Houses"" in ""Front Yard Landscaping With Rocks"", slug concept ""front yard rock landscaping brick houses"", keywords ""front yard landscaping, rock landscaping for brick homes, curb appeal"". Scene: wide street-level architectural hero photograph showing the full property, driveway edge, walkway, porch, and complete landscape layout; this must read as a broad exterior establishing shot. The image must immediately communicate Rock Landscaping and must visibly include brick walkway or edging, rocks, gravel, boulders, stone borders, real stone texture. Use natural daylight, believable American suburban architecture, real landscaping, real plant scale, authentic stone/soil/mulch/flower textures, magazine-quality curb appeal, no staged showroom look. Reserve clean readable negative space for a later overlay without covering the main landscaping subject; keep the most important yard feature away from the center title zone and bottom CTA zone. Do not render text into the base photo; add the overlay in post-production using the overlay fields.",FRONT YARD AURA,Front Yard Rock Landscaping for Brick Houses,Must-See Stone Ideas,"Premium Pinterest typography with strict mobile-safe layout: title max width 820px, 90px side padding, automatic font sizing, controlled line wrapping, and no text overflow outside the image. Use a light readability treatment only: subtle shadow, soft local panel behind title, and reduced dark overlay so the photo stays bright. Keep title and CTA inside safe margins and away from the core landscape detail. center title over calm sky, lawn, or facade negative space","Wide exterior view, hero shot, full property view","full American home exterior, front yard, entry path, foundation beds, street-facing curb appeal",Ultra realistic; photorealistic; DSLR photography; natural lighting; real American homes; real landscaping; real textures; professional architectural photography; Pinterest worthy; magazine quality.,Candidate only. Do not publish until scripts/generate-production-pins.mjs assigns quality_status=approved after strict image-source filtering.,approved,,rock-landscaping,"Rocks, boulders, or gravel visible",83,unsplash:photo-1728519525007-551778d07883,photo-1728519525007-551778d07883,photo 1728519525007 551778d07883,unsplash-expanded-search,https://images.unsplash.com/photo-1728519525007-551778d07883,a stone path leading to a house in the woods a stone path leading to a house in the woods r2j ngxus 8 a stone path leading to a house in the woods a stone path leading to a house in the woods r2j ngxus 8,2026-06-04T18:52:25.466Z
front-yard-rock-landscaping-for-sloped-yards-a,front-yard-rock-landscaping-for-sloped-yards,Front Yard Rock Landscaping for Sloped Yards,Front Yard Landscaping With Rocks,front-yard-landscaping-with-rocks,Front Yard Landscaping With Rocks,front-yard-landscaping-with-rocks,A,Front Yard Rock Landscaping for Sloped Yards: Hero Curb Appeal View,"See the full-property view for Front Yard Rock Landscaping for Sloped Yards: rocks, gravel, boulders, stone borders, real American curb appeal, natural light, and practical front yard landscaping ideas. Front Yard Rock Landscaping for Sloped Yards with erosion control, terraced stone, and layered planting, natural light, and a polished Pinterest-ready look.",Rock Landscaping; rock landscaping; gravel front yard; stone border; boulder landscaping; hero exterior; full property view; curb appeal view; front yard inspiration; front yard landscaping; sloped rock landscaping; curb appeal; Front Yard Landscaping With Rocks; front yard rock landscaping sloped yards; rocks; gravel,"Wide exterior view, hero shot, full property view for Front Yard Rock Landscaping for Sloped Yards, showing rocks, gravel, boulders around a realistic American home.",https://frontyardaura.com/blog/front-yard-rock-landscaping-for-sloped-yards/,front-yard-rock-landscaping-for-sloped-yards-pin-a-13s86.jpg,https://frontyardaura.com/pins/front-yard-rock-landscaping-for-sloped-yards-pin-a-13s86.jpg,"Ultra realistic photorealistic DSLR vertical 2:3 Pinterest image, 1000x1500 composition, professional architectural photography of a real American home. Article match: ""Front Yard Rock Landscaping for Sloped Yards"" in ""Front Yard Landscaping With Rocks"", slug concept ""front yard rock landscaping sloped yards"", keywords ""front yard landscaping, sloped rock landscaping, curb appeal"". Scene: wide street-level architectural hero photograph showing the full property, driveway edge, walkway, porch, and complete landscape layout; this must read as a broad exterior establishing shot. The image must immediately communicate Rock Landscaping and must visibly include rocks, gravel, boulders, stone borders, real stone texture. Use natural daylight, believable American suburban architecture, real landscaping, real plant scale, authentic stone/soil/mulch/flower textures, magazine-quality curb appeal, no staged showroom look. Reserve clean readable negative space for a later overlay without covering the main landscaping subject; keep the most important yard feature away from the center title zone and bottom CTA zone. Do not render text into the base photo; add the overlay in post-production using the overlay fields.",FRONT YARD AURA,Front Yard Rock Landscaping for Sloped Yards,Must-See Stone Ideas,"Premium Pinterest typography with strict mobile-safe layout: title max width 820px, 90px side padding, automatic font sizing, controlled line wrapping, and no text overflow outside the image. Use a light readability treatment only: subtle shadow, soft local panel behind title, and reduced dark overlay so the photo stays bright. Keep title and CTA inside safe margins and away from the core landscape detail. center title over calm sky, lawn, or facade negative space","Wide exterior view, hero shot, full property view","full American home exterior, front yard, entry path, foundation beds, street-facing curb appeal",Ultra realistic; photorealistic; DSLR photography; natural lighting; real American homes; real landscaping; real textures; professional architectural photography; Pinterest worthy; magazine quality.,Candidate only. Do not publish until scripts/generate-production-pins.mjs assigns quality_status=approved after strict image-source filtering.,approved,,rock-landscaping,"Rocks, boulders, or gravel visible",88,unsplash:photo-1725105260797-f108863c9931,photo-1725105260797-f108863c9931,photo 1725105260797 f108863c9931,unsplash-search,https://images.unsplash.com/photo-1725105260797-f108863c9931,a grassy area with rocks and trees in the background 薔薇rose beautiful green and flower garden beautiful and pretty flowers、新緑と美しい花が織りなす絶景 a superb view of fresh greenery and beautiful flowers a grassy area with rocks and trees in the background ysywt4xckr8 a grassy area with rocks and trees in the background 薔薇rose beautiful green and flower garden beautiful and pretty flowers、新緑と美しい花が織りなす絶景 a superb view of fresh greenery and beautiful flowers a grassy area with rocks and trees in the background ysywt4xckr8,2026-06-03T15:51:32.843Z
