pin_id,article_slug,article_title,category,category_slug,board_name,board_slug,pin_variant,pin_title,pin_description,keywords,alt_text,destination_url,image_file,image_url,image_prompt,overlay_top,overlay_center,overlay_bottom,overlay_style,composition,visual_focus,quality_rules,compliance_notes,quality_status,quality_rejection_reasons,quality_rule_key,quality_rule_label,quality_score,source_signature,quality_source_id,quality_source_key,quality_source_type,quality_source_url,quality_source_text,quality_checked_at
front-yard-flower-bed-ideas-for-brick-walkways-b,front-yard-flower-bed-ideas-for-brick-walkways,Front Yard Flower Bed Ideas for Brick Walkways,Front Yard Flower Bed Ideas,front-yard-flower-bed-ideas,Front Yard Flower Bed Ideas,front-yard-flower-bed-ideas,B,Flower Beds Details for Front Yard Flower Bed Ideas for Brick Walkways,"Save the close-up detail for Front Yard Flower Bed Ideas for Brick Walkways: brick walkway or edging, real flower beds, seasonal flowers, garden borders, real American curb appeal, natural light, and practical front yard landscaping ideas. Front Yard Flower Bed Ideas for Brick Walkways with warm path edges, layered blooms, and traditional curb appeal, realistic photography, and a Pinterest-ready front yard look.",Flower Beds; flower bed ideas; seasonal flowers; garden border; front yard flowers; landscaping detail; garden texture; close-up design; front yard detail; front yard landscaping; brick walkway flower beds; curb appeal; Front Yard Flower Bed Ideas; front yard flower bed ideas brick walkways; brick walkway or edging; real flower beds,"Close landscaping detail focused on the article topic for Front Yard Flower Bed Ideas for Brick Walkways, showing brick walkway or edging, real flower beds, seasonal flowers around a realistic American home.",https://frontyardaura.com/blog/front-yard-flower-bed-ideas-for-brick-walkways/,front-yard-flower-bed-ideas-for-brick-walkways-pin-b-1yuq2.jpg,https://frontyardaura.com/pins/front-yard-flower-bed-ideas-for-brick-walkways-pin-b-1yuq2.jpg,"Ultra realistic photorealistic DSLR vertical 2:3 Pinterest image, 1000x1500 composition, professional architectural photography of a real American home. Article match: ""Front Yard Flower Bed Ideas for Brick Walkways"" in ""Front Yard Flower Bed Ideas"", slug concept ""front yard flower bed ideas brick walkways"", keywords ""front yard landscaping, brick walkway flower beds, curb appeal"". Scene: close DSLR editorial detail at garden-bed height, focused tightly on the exact landscaping element from the article topic; do not show the full house and do not repeat the wide hero composition. The image must immediately communicate Flower Beds and must visibly include brick walkway or edging, real flower beds, seasonal flowers, garden borders, layered planting. Use natural daylight, believable American suburban architecture, real landscaping, real plant scale, authentic stone/soil/mulch/flower textures, magazine-quality curb appeal, no staged showroom look. Reserve clean readable negative space for a later overlay without covering the main landscaping subject; keep the most important yard feature away from the center title zone and bottom CTA zone. Do not render text into the base photo; add the overlay in post-production using the overlay fields.",FRONT YARD AURA,Front Yard Flower Bed Ideas for Brick Walkways,Beautiful Flower Bed Ideas,"Premium Pinterest typography with strict mobile-safe layout: title max width 820px, 90px side padding, automatic font sizing, controlled line wrapping, and no text overflow outside the image. Use a light readability treatment only: subtle shadow, soft local panel behind title, and reduced dark overlay so the photo stays bright. Keep title and CTA inside safe margins and away from the core landscape detail. center title on a subtle translucent dark gradient above the close detail",Close landscaping detail focused on the article topic,"close detail of the main landscape material or planting, with real texture and the home softly visible",Ultra realistic; photorealistic; DSLR photography; natural lighting; real American homes; real landscaping; real textures; professional architectural photography; Pinterest worthy; magazine quality.,Candidate only. Do not publish until scripts/generate-production-pins.mjs assigns quality_status=approved after strict image-source filtering.,approved,,flower-bed,Flower bed or flowers visible,84,unsplash:photo-1629899104925-ddb87c4cd239,photo-1629899104925-ddb87c4cd239,photo 1629899104925 ddb87c4cd239,unsplash-search,https://images.unsplash.com/photo-1629899104925-ddb87c4cd239,red and white flowers in front of brown brick house red and white flowers in front of brown brick house y96rwdjv7lk red and white flowers in front of brown brick house red and white flowers in front of brown brick house y96rwdjv7lk,2026-06-03T15:51:32.843Z
front-yard-flower-bed-ideas-for-brick-walkways-c,front-yard-flower-bed-ideas-for-brick-walkways,Front Yard Flower Bed Ideas for Brick Walkways,Front Yard Flower Bed Ideas,front-yard-flower-bed-ideas,Front Yard Flower Bed Ideas,front-yard-flower-bed-ideas,C,Front Yard Flower Bed Ideas for Brick Walkways: Fresh Angle Inspiration,"Explore a fresh angle for Front Yard Flower Bed Ideas for Brick Walkways: brick walkway or edging, real flower beds, seasonal flowers, garden borders, real American curb appeal, natural light, and practical front yard landscaping ideas. Front Yard Flower Bed Ideas for Brick Walkways with warm path edges, layered blooms, and traditional curb appeal, realistic photography, and a Pinterest-ready front yard look.",Flower Beds; flower bed ideas; seasonal flowers; garden border; front yard flowers; fresh angle; entry perspective; walkway view; save for later; front yard landscaping; brick walkway flower beds; curb appeal; Front Yard Flower Bed Ideas; front yard flower bed ideas brick walkways; brick walkway or edging; real flower beds,"Different angle of the same topic with a completely different composition for Front Yard Flower Bed Ideas for Brick Walkways, showing brick walkway or edging, real flower beds, seasonal flowers around a realistic American home.",https://frontyardaura.com/blog/front-yard-flower-bed-ideas-for-brick-walkways/,front-yard-flower-bed-ideas-for-brick-walkways-pin-c-3lmdt.jpg,https://frontyardaura.com/pins/front-yard-flower-bed-ideas-for-brick-walkways-pin-c-3lmdt.jpg,"Ultra realistic photorealistic DSLR vertical 2:3 Pinterest image, 1000x1500 composition, professional architectural photography of a real American home. Article match: ""Front Yard Flower Bed Ideas for Brick Walkways"" in ""Front Yard Flower Bed Ideas"", slug concept ""front yard flower bed ideas brick walkways"", keywords ""front yard landscaping, brick walkway flower beds, curb appeal"". Scene: three-quarter angle from the walkway or driveway, with a different foreground, depth, and entry composition; this must be visibly different from both the wide hero shot and the close detail shot. The image must immediately communicate Flower Beds and must visibly include brick walkway or edging, real flower beds, seasonal flowers, garden borders, layered planting. Use natural daylight, believable American suburban architecture, real landscaping, real plant scale, authentic stone/soil/mulch/flower textures, magazine-quality curb appeal, no staged showroom look. Reserve clean readable negative space for a later overlay without covering the main landscaping subject; keep the most important yard feature away from the center title zone and bottom CTA zone. Do not render text into the base photo; add the overlay in post-production using the overlay fields.",FRONT YARD AURA,Front Yard Flower Bed Ideas for Brick Walkways,Save This Garden Look,"Premium Pinterest typography with strict mobile-safe layout: title max width 820px, 90px side padding, automatic font sizing, controlled line wrapping, and no text overflow outside the image. Use a light readability treatment only: subtle shadow, soft local panel behind title, and reduced dark overlay so the photo stays bright. Keep title and CTA inside safe margins and away from the core landscape detail. center title offset over clean path or planting negative space",Different angle of the same topic with a completely different composition,"three-quarter entry view from the walkway or driveway, different framing from the hero and close-up images",Ultra realistic; photorealistic; DSLR photography; natural lighting; real American homes; real landscaping; real textures; professional architectural photography; Pinterest worthy; magazine quality.,Candidate only. Do not publish until scripts/generate-production-pins.mjs assigns quality_status=approved after strict image-source filtering.,approved,,flower-bed,Flower bed or flowers visible,82,unsplash:photo-1774939234260-1f863f8a3ff9,photo-1774939234260-1f863f8a3ff9,photo 1774939234260 1f863f8a3ff9,unsplash-search,https://images.unsplash.com/photo-1774939234260-1f863f8a3ff9,a paved path winds through a park with flowers. a paved path winds through a park with flowers wbadj56qxjg a paved path winds through a park with flowers. a paved path winds through a park with flowers wbadj56qxjg,2026-06-03T15:51:32.843Z
front-yard-flower-bed-ideas-for-curb-appeal-a,front-yard-flower-bed-ideas-for-curb-appeal,Front Yard Flower Bed Ideas for Instant Curb Appeal,Front Yard Flower Bed Ideas,front-yard-flower-bed-ideas,Front Yard Flower Bed Ideas,front-yard-flower-bed-ideas,A,Beautiful Flower Bed Designs: Hero Curb Appeal View,"See the full-property view for Front Yard Flower Bed Ideas for Instant Curb Appeal: real flower beds, seasonal flowers, garden borders, layered planting, real American curb appeal, natural light, and practical front yard landscaping ideas. Front yard flower bed ideas with layered planting, seasonal color, and polished curb appeal for American homes.",Flower Beds; flower bed ideas; seasonal flowers; garden border; front yard flowers; hero exterior; full property view; curb appeal view; front yard inspiration; flower beds; curb appeal; Front Yard Flower Bed Ideas; front yard flower bed ideas curb appeal; real flower beds; garden borders; layered planting,"Wide exterior view, hero shot, full property view for Front Yard Flower Bed Ideas for Instant Curb Appeal, showing real flower beds, seasonal flowers, garden borders around a realistic American home.",https://frontyardaura.com/blog/front-yard-flower-bed-ideas-for-curb-appeal/,front-yard-flower-bed-ideas-for-curb-appeal-pin-a-55v20.jpg,https://frontyardaura.com/pins/front-yard-flower-bed-ideas-for-curb-appeal-pin-a-55v20.jpg,"Ultra realistic photorealistic DSLR vertical 2:3 Pinterest image, 1000x1500 composition, professional architectural photography of a real American home. Article match: ""Front Yard Flower Bed Ideas for Instant Curb Appeal"" in ""Front Yard Flower Bed Ideas"", slug concept ""front yard flower bed ideas curb appeal"", keywords ""flower beds, front yard flowers, curb appeal"". Scene: wide street-level architectural hero photograph showing the full property, driveway edge, walkway, porch, and complete landscape layout; this must read as a broad exterior establishing shot. The image must immediately communicate Flower Beds and must visibly include real flower beds, seasonal flowers, garden borders, layered planting. Use natural daylight, believable American suburban architecture, real landscaping, real plant scale, authentic stone/soil/mulch/flower textures, magazine-quality curb appeal, no staged showroom look. Reserve clean readable negative space for a later overlay without covering the main landscaping subject; keep the most important yard feature away from the center title zone and bottom CTA zone. Do not render text into the base photo; add the overlay in post-production using the overlay fields.",FRONT YARD AURA,Front Yard Flower Bed Ideas for Instant Curb Appeal,Seasonal Curb Appeal,"Premium Pinterest typography with strict mobile-safe layout: title max width 820px, 90px side padding, automatic font sizing, controlled line wrapping, and no text overflow outside the image. Use a light readability treatment only: subtle shadow, soft local panel behind title, and reduced dark overlay so the photo stays bright. Keep title and CTA inside safe margins and away from the core landscape detail. center title over calm sky, lawn, or facade negative space","Wide exterior view, hero shot, full property view","full American home exterior, front yard, entry path, foundation beds, street-facing curb appeal",Ultra realistic; photorealistic; DSLR photography; natural lighting; real American homes; real landscaping; real textures; professional architectural photography; Pinterest worthy; magazine quality.,Candidate only. Do not publish until scripts/generate-production-pins.mjs assigns quality_status=approved after strict image-source filtering.,approved,,flower-bed,Flower bed or flowers visible,83,unsplash:photo-1592521228955-de1a5aab7150,photo-1592521228955-de1a5aab7150,photo 1592521228955 de1a5aab7150,unsplash-expanded-search,https://images.unsplash.com/photo-1592521228955-de1a5aab7150,"red flowers on green leaves denmark, danmark, humlebæk, flowers, flower, rose, red, green, house, garden, cute, vibes, grain, grainy look, mood red flowers on green leaves zmwuqp7l0qa red flowers on green leaves denmark, danmark, humlebæk, flowers, flower, rose, red, green, house, garden, cute, vibes, grain, grainy look, mood red flowers on green leaves zmwuqp7l0qa",2026-06-04T18:25:57.613Z
front-yard-flower-bed-ideas-for-ranch-houses-a,front-yard-flower-bed-ideas-for-ranch-houses,Front Yard Flower Bed Ideas for Ranch Houses,Front Yard Flower Bed Ideas,front-yard-flower-bed-ideas,Front Yard Flower Bed Ideas,front-yard-flower-bed-ideas,A,Front Yard Flower Bed Ideas for Ranch Houses: Hero Curb Appeal View,"See the full-property view for Front Yard Flower Bed Ideas for Ranch Houses: real flower beds, seasonal flowers, garden borders, layered planting, real American curb appeal, natural light, and practical front yard landscaping ideas. Front Yard Flower Bed Ideas for Ranch Houses with long low borders, entry color, and balanced proportions, natural light, and a polished Pinterest-ready look.",Flower Beds; flower bed ideas; seasonal flowers; garden border; front yard flowers; hero exterior; full property view; curb appeal view; front yard inspiration; front yard landscaping; ranch house flower beds; curb appeal; Front Yard Flower Bed Ideas; front yard flower bed ideas ranch houses; real flower beds; garden borders,"Wide exterior view, hero shot, full property view for Front Yard Flower Bed Ideas for Ranch Houses, showing real flower beds, seasonal flowers, garden borders around a realistic American home.",https://frontyardaura.com/blog/front-yard-flower-bed-ideas-for-ranch-houses/,front-yard-flower-bed-ideas-for-ranch-houses-pin-a-ksb6x.jpg,https://frontyardaura.com/pins/front-yard-flower-bed-ideas-for-ranch-houses-pin-a-ksb6x.jpg,"Ultra realistic photorealistic DSLR vertical 2:3 Pinterest image, 1000x1500 composition, professional architectural photography of a real American home. Article match: ""Front Yard Flower Bed Ideas for Ranch Houses"" in ""Front Yard Flower Bed Ideas"", slug concept ""front yard flower bed ideas ranch houses"", keywords ""front yard landscaping, ranch house flower beds, curb appeal"". Scene: wide street-level architectural hero photograph showing the full property, driveway edge, walkway, porch, and complete landscape layout; this must read as a broad exterior establishing shot. The image must immediately communicate Flower Beds and must visibly include real flower beds, seasonal flowers, garden borders, layered planting. Use natural daylight, believable American suburban architecture, real landscaping, real plant scale, authentic stone/soil/mulch/flower textures, magazine-quality curb appeal, no staged showroom look. Reserve clean readable negative space for a later overlay without covering the main landscaping subject; keep the most important yard feature away from the center title zone and bottom CTA zone. Do not render text into the base photo; add the overlay in post-production using the overlay fields.",FRONT YARD AURA,Front Yard Flower Bed Ideas for Ranch Houses,Seasonal Curb Appeal,"Premium Pinterest typography with strict mobile-safe layout: title max width 820px, 90px side padding, automatic font sizing, controlled line wrapping, and no text overflow outside the image. Use a light readability treatment only: subtle shadow, soft local panel behind title, and reduced dark overlay so the photo stays bright. Keep title and CTA inside safe margins and away from the core landscape detail. center title over calm sky, lawn, or facade negative space","Wide exterior view, hero shot, full property view","full American home exterior, front yard, entry path, foundation beds, street-facing curb appeal",Ultra realistic; photorealistic; DSLR photography; natural lighting; real American homes; real landscaping; real textures; professional architectural photography; Pinterest worthy; magazine quality.,Candidate only. Do not publish until scripts/generate-production-pins.mjs assigns quality_status=approved after strict image-source filtering.,approved,,flower-bed,Flower bed or flowers visible,83,unsplash:photo-1723008981969-0b194a24c66c,photo-1723008981969-0b194a24c66c,photo 1723008981969 0b194a24c66c,unsplash-expanded-search,https://images.unsplash.com/photo-1723008981969-0b194a24c66c,"a house with a flower garden in front of it vicars close, wells taken using nikon l35 af / kodak gold 200 a house with a flower garden in front of it a7wcplefxg4 film a house with a flower garden in front of it vicars close, wells taken using nikon l35 af / kodak gold 200 a house with a flower garden in front of it a7wcplefxg4 film",2026-06-04T18:25:57.613Z
front-yard-flower-bed-ideas-for-shady-porches-a,front-yard-flower-bed-ideas-for-shady-porches,Front Yard Flower Bed Ideas for Shady Porches,Front Yard Flower Bed Ideas,front-yard-flower-bed-ideas,Front Yard Flower Bed Ideas,front-yard-flower-bed-ideas,A,Front Yard Flower Bed Ideas for Shady Porches: Hero Curb Appeal View,"See the full-property view for Front Yard Flower Bed Ideas for Shady Porches: front porch planters, real flower beds, seasonal flowers, garden borders, real American curb appeal, natural light, and practical front yard landscaping ideas. Front Yard Flower Bed Ideas for Shady Porches with cool foliage, pale blooms, and a softer front entry, natural light, and a polished Pinterest-ready look.",Flower Beds; flower bed ideas; seasonal flowers; garden border; front yard flowers; hero exterior; full property view; curb appeal view; front yard inspiration; front yard landscaping; shady porch flower beds; curb appeal; Front Yard Flower Bed Ideas; front yard flower bed ideas shady porches; front porch planters; real flower beds,"Wide exterior view, hero shot, full property view for Front Yard Flower Bed Ideas for Shady Porches, showing front porch planters, real flower beds, seasonal flowers around a realistic American home.",https://frontyardaura.com/blog/front-yard-flower-bed-ideas-for-shady-porches/,front-yard-flower-bed-ideas-for-shady-porches-pin-a-1gzz1.jpg,https://frontyardaura.com/pins/front-yard-flower-bed-ideas-for-shady-porches-pin-a-1gzz1.jpg,"Ultra realistic photorealistic DSLR vertical 2:3 Pinterest image, 1000x1500 composition, professional architectural photography of a real American home. Article match: ""Front Yard Flower Bed Ideas for Shady Porches"" in ""Front Yard Flower Bed Ideas"", slug concept ""front yard flower bed ideas shady porches"", keywords ""front yard landscaping, shady porch flower beds, curb appeal"". Scene: wide street-level architectural hero photograph showing the full property, driveway edge, walkway, porch, and complete landscape layout; this must read as a broad exterior establishing shot. The image must immediately communicate Flower Beds and must visibly include front porch planters, real flower beds, seasonal flowers, garden borders, layered planting. Use natural daylight, believable American suburban architecture, real landscaping, real plant scale, authentic stone/soil/mulch/flower textures, magazine-quality curb appeal, no staged showroom look. Reserve clean readable negative space for a later overlay without covering the main landscaping subject; keep the most important yard feature away from the center title zone and bottom CTA zone. Do not render text into the base photo; add the overlay in post-production using the overlay fields.",FRONT YARD AURA,Front Yard Flower Bed Ideas for Shady Porches,Seasonal Curb Appeal,"Premium Pinterest typography with strict mobile-safe layout: title max width 820px, 90px side padding, automatic font sizing, controlled line wrapping, and no text overflow outside the image. Use a light readability treatment only: subtle shadow, soft local panel behind title, and reduced dark overlay so the photo stays bright. Keep title and CTA inside safe margins and away from the core landscape detail. center title over calm sky, lawn, or facade negative space","Wide exterior view, hero shot, full property view","full American home exterior, front yard, entry path, foundation beds, street-facing curb appeal",Ultra realistic; photorealistic; DSLR photography; natural lighting; real American homes; real landscaping; real textures; professional architectural photography; Pinterest worthy; magazine quality.,Candidate only. Do not publish until scripts/generate-production-pins.mjs assigns quality_status=approved after strict image-source filtering.,approved,,flower-bed,Flower bed or flowers visible,83,unsplash:photo-1505128996263-6d566b34149a,photo-1505128996263-6d566b34149a,photo 1505128996263 6d566b34149a,unsplash-expanded-search,https://images.unsplash.com/photo-1505128996263-6d566b34149a,"pink petaled flower selective focus photography uppark house garden, petersfield pink petaled flower selective focus photography 7qtwk41ndgm pink petaled flower selective focus photography uppark house garden, petersfield pink petaled flower selective focus photography 7qtwk41ndgm",2026-06-04T18:25:57.613Z
