pin_id,article_slug,article_title,category,category_slug,board_name,board_slug,pin_variant,pin_title,pin_description,keywords,alt_text,destination_url,image_file,image_url,image_prompt,overlay_top,overlay_center,overlay_bottom,overlay_style,composition,visual_focus,quality_rules,compliance_notes,quality_status,quality_rejection_reasons,quality_rule_key,quality_rule_label,quality_score,source_signature,quality_source_id,quality_source_key,quality_source_type,quality_source_url,quality_source_text,quality_checked_at
curb-appeal-landscaping-with-front-yard-focal-points-c,curb-appeal-landscaping-with-front-yard-focal-points,Curb Appeal Landscaping With Front Yard Focal Points,Curb Appeal Landscaping Ideas,curb-appeal-landscaping-ideas,Curb Appeal Landscaping Ideas,curb-appeal-landscaping-ideas,C,Curb Appeal Landscaping With Front Yard Focal Points: Fresh Angle Inspiration,"Explore a fresh angle for Curb Appeal Landscaping With Front Yard Focal Points: luxury American home exterior, elegant entry, premium landscaping, layered curb appeal, real American curb appeal, natural light, and practical front yard landscaping ideas. Curb Appeal Landscaping With Front Yard Focal Points with entry anchors, statement planting, and memorable curb appeal, natural light, and a polished Pinterest-ready front yard look.",Luxury Curb Appeal; luxury curb appeal; premium landscaping; front yard curb appeal; elegant exterior; fresh angle; entry perspective; walkway view; save for later; front yard landscaping; front yard focal points; curb appeal; Curb Appeal Landscaping Ideas; curb appeal landscaping front yard focal points; luxury American home exterior; elegant entry,"Different angle of the same topic with a completely different composition for Curb Appeal Landscaping With Front Yard Focal Points, showing luxury American home exterior, elegant entry, premium landscaping around a realistic American home.",https://frontyardaura.com/blog/curb-appeal-landscaping-with-front-yard-focal-points/,curb-appeal-landscaping-with-front-yard-focal-points-pin-c-1p82f.jpg,https://frontyardaura.com/pins/curb-appeal-landscaping-with-front-yard-focal-points-pin-c-1p82f.jpg,"Ultra realistic photorealistic DSLR vertical 2:3 Pinterest image, 1000x1500 composition, professional architectural photography of a real American home. Article match: ""Curb Appeal Landscaping With Front Yard Focal Points"" in ""Curb Appeal Landscaping Ideas"", slug concept ""curb appeal landscaping front yard focal points"", keywords ""front yard landscaping, front yard focal points, curb appeal"". Scene: three-quarter angle from the walkway or driveway, with a different foreground, depth, and entry composition; this must be visibly different from both the wide hero shot and the close detail shot. The image must immediately communicate Luxury Curb Appeal and must visibly include luxury American home exterior, elegant entry, premium landscaping, layered curb appeal. Use natural daylight, believable American suburban architecture, real landscaping, real plant scale, authentic stone/soil/mulch/flower textures, magazine-quality curb appeal, no staged showroom look. Reserve clean readable negative space for a later overlay without covering the main landscaping subject; keep the most important yard feature away from the center title zone and bottom CTA zone. Do not render text into the base photo; add the overlay in post-production using the overlay fields.",FRONT YARD AURA,Curb Appeal Landscaping With Front Yard Focal Points,Premium Front Yard Look,"Premium Pinterest typography with strict mobile-safe layout: title max width 820px, 90px side padding, automatic font sizing, controlled line wrapping, and no text overflow outside the image. Use a light readability treatment only: subtle shadow, soft local panel behind title, and reduced dark overlay so the photo stays bright. Keep title and CTA inside safe margins and away from the core landscape detail. center title offset over clean path or planting negative space",Different angle of the same topic with a completely different composition,"three-quarter entry view from the walkway or driveway, different framing from the hero and close-up images",Ultra realistic; photorealistic; DSLR photography; natural lighting; real American homes; real landscaping; real textures; professional architectural photography; Pinterest worthy; magazine quality.,Candidate only. Do not publish until scripts/generate-production-pins.mjs assigns quality_status=approved after strict image-source filtering.,approved,,front-yard-exterior,Front yard and exterior visible,98,unsplash:photo-1761418022097-621b807bea0f,photo-1761418022097-621b807bea0f,photo 1761418022097 621b807bea0f,unsplash-search,https://images.unsplash.com/photo-1761418022097-621b807bea0f,white stucco house with palm trees and garden. nikon f3 portra 400 white stucco house with palm trees and garden eek1ju rfrw film white stucco house with palm trees and garden. nikon f3 portra 400 white stucco house with palm trees and garden eek1ju rfrw film,2026-06-03T15:51:32.843Z
curb-appeal-landscaping-with-front-yard-trees-a,curb-appeal-landscaping-with-front-yard-trees,Curb Appeal Landscaping With Front Yard Trees,Curb Appeal Landscaping Ideas,curb-appeal-landscaping-ideas,Curb Appeal Landscaping Ideas,curb-appeal-landscaping-ideas,A,Curb Appeal Landscaping With Front Yard Trees: Hero Curb Appeal View,"See the full-property view for Curb Appeal Landscaping With Front Yard Trees: luxury American home exterior, elegant entry, premium landscaping, layered curb appeal, real American curb appeal, natural light, and practical front yard landscaping ideas. Curb Appeal Landscaping With Front Yard Trees with shade, scale, and long-term curb appeal structure, natural light, and a polished Pinterest-ready look.",Luxury Curb Appeal; luxury curb appeal; premium landscaping; front yard curb appeal; elegant exterior; hero exterior; full property view; curb appeal view; front yard inspiration; front yard landscaping; front yard trees; curb appeal; Curb Appeal Landscaping Ideas; curb appeal landscaping front yard trees; luxury American home exterior; elegant entry,"Wide exterior view, hero shot, full property view for Curb Appeal Landscaping With Front Yard Trees, showing luxury American home exterior, elegant entry, premium landscaping around a realistic American home.",https://frontyardaura.com/blog/curb-appeal-landscaping-with-front-yard-trees/,curb-appeal-landscaping-with-front-yard-trees-pin-a-57stc.jpg,https://frontyardaura.com/pins/curb-appeal-landscaping-with-front-yard-trees-pin-a-57stc.jpg,"Ultra realistic photorealistic DSLR vertical 2:3 Pinterest image, 1000x1500 composition, professional architectural photography of a real American home. Article match: ""Curb Appeal Landscaping With Front Yard Trees"" in ""Curb Appeal Landscaping Ideas"", slug concept ""curb appeal landscaping front yard trees"", keywords ""front yard landscaping, front yard trees, curb appeal"". Scene: wide street-level architectural hero photograph showing the full property, driveway edge, walkway, porch, and complete landscape layout; this must read as a broad exterior establishing shot. The image must immediately communicate Luxury Curb Appeal and must visibly include luxury American home exterior, elegant entry, premium landscaping, layered curb appeal. Use natural daylight, believable American suburban architecture, real landscaping, real plant scale, authentic stone/soil/mulch/flower textures, magazine-quality curb appeal, no staged showroom look. Reserve clean readable negative space for a later overlay without covering the main landscaping subject; keep the most important yard feature away from the center title zone and bottom CTA zone. Do not render text into the base photo; add the overlay in post-production using the overlay fields.",FRONT YARD AURA,Curb Appeal Landscaping With Front Yard Trees,Luxury Curb Appeal,"Premium Pinterest typography with strict mobile-safe layout: title max width 820px, 90px side padding, automatic font sizing, controlled line wrapping, and no text overflow outside the image. Use a light readability treatment only: subtle shadow, soft local panel behind title, and reduced dark overlay so the photo stays bright. Keep title and CTA inside safe margins and away from the core landscape detail. center title over calm sky, lawn, or facade negative space","Wide exterior view, hero shot, full property view","full American home exterior, front yard, entry path, foundation beds, street-facing curb appeal",Ultra realistic; photorealistic; DSLR photography; natural lighting; real American homes; real landscaping; real textures; professional architectural photography; Pinterest worthy; magazine quality.,Candidate only. Do not publish until scripts/generate-production-pins.mjs assigns quality_status=approved after strict image-source filtering.,approved,,front-yard-exterior,Front yard and exterior visible,83,unsplash:photo-1766232590183-415b96b9da6d,photo-1766232590183-415b96b9da6d,photo 1766232590183 415b96b9da6d,unsplash-expanded-search,https://images.unsplash.com/photo-1766232590183-415b96b9da6d,narrow path between rustic wooden and brick buildings. brest old house narrow path between rustic wooden and brick buildings eqzoxstgzvq narrow path between rustic wooden and brick buildings. brest old house narrow path between rustic wooden and brick buildings eqzoxstgzvq,2026-06-04T18:25:57.613Z
curb-appeal-landscaping-with-seasonal-containers-a,curb-appeal-landscaping-with-seasonal-containers,Curb Appeal Landscaping With Seasonal Containers,Curb Appeal Landscaping Ideas,curb-appeal-landscaping-ideas,Curb Appeal Landscaping Ideas,curb-appeal-landscaping-ideas,A,Curb Appeal Landscaping With Seasonal Containers: Hero Curb Appeal View,"See the full-property view for Curb Appeal Landscaping With Seasonal Containers: luxury American home exterior, elegant entry, premium landscaping, layered curb appeal, real American curb appeal, natural light, and practical front yard landscaping ideas. Curb Appeal Landscaping With Seasonal Containers with fresh porch color, simple updates, and premium front door styling, realistic photography, and a Pinterest-ready front yard look.",Luxury Curb Appeal; luxury curb appeal; premium landscaping; front yard curb appeal; elegant exterior; hero exterior; full property view; curb appeal view; front yard inspiration; front yard landscaping; seasonal container curb appeal; curb appeal; Curb Appeal Landscaping Ideas; curb appeal landscaping seasonal containers; luxury American home exterior; elegant entry,"Wide exterior view, hero shot, full property view for Curb Appeal Landscaping With Seasonal Containers, showing luxury American home exterior, elegant entry, premium landscaping around a realistic American home.",https://frontyardaura.com/blog/curb-appeal-landscaping-with-seasonal-containers/,curb-appeal-landscaping-with-seasonal-containers-pin-a-1bf97.jpg,https://frontyardaura.com/pins/curb-appeal-landscaping-with-seasonal-containers-pin-a-1bf97.jpg,"Ultra realistic photorealistic DSLR vertical 2:3 Pinterest image, 1000x1500 composition, professional architectural photography of a real American home. Article match: ""Curb Appeal Landscaping With Seasonal Containers"" in ""Curb Appeal Landscaping Ideas"", slug concept ""curb appeal landscaping seasonal containers"", keywords ""front yard landscaping, seasonal container curb appeal, curb appeal"". Scene: wide street-level architectural hero photograph showing the full property, driveway edge, walkway, porch, and complete landscape layout; this must read as a broad exterior establishing shot. The image must immediately communicate Luxury Curb Appeal and must visibly include luxury American home exterior, elegant entry, premium landscaping, layered curb appeal. Use natural daylight, believable American suburban architecture, real landscaping, real plant scale, authentic stone/soil/mulch/flower textures, magazine-quality curb appeal, no staged showroom look. Reserve clean readable negative space for a later overlay without covering the main landscaping subject; keep the most important yard feature away from the center title zone and bottom CTA zone. Do not render text into the base photo; add the overlay in post-production using the overlay fields.",FRONT YARD AURA,Curb Appeal Landscaping With Seasonal Containers,Luxury Curb Appeal,"Premium Pinterest typography with strict mobile-safe layout: title max width 820px, 90px side padding, automatic font sizing, controlled line wrapping, and no text overflow outside the image. Use a light readability treatment only: subtle shadow, soft local panel behind title, and reduced dark overlay so the photo stays bright. Keep title and CTA inside safe margins and away from the core landscape detail. center title over calm sky, lawn, or facade negative space","Wide exterior view, hero shot, full property view","full American home exterior, front yard, entry path, foundation beds, street-facing curb appeal",Ultra realistic; photorealistic; DSLR photography; natural lighting; real American homes; real landscaping; real textures; professional architectural photography; Pinterest worthy; magazine quality.,Candidate only. Do not publish until scripts/generate-production-pins.mjs assigns quality_status=approved after strict image-source filtering.,approved,,planters,Planters or containers visible,84,unsplash:photo-1761061079411-7cc03db36d71,photo-1761061079411-7cc03db36d71,photo 1761061079411 7cc03db36d71,unsplash-search,https://images.unsplash.com/photo-1761061079411-7cc03db36d71,yellow house entrance with lanterns and potted plants. cozy inn entrance with lanterns yellow house entrance with lanterns and potted plants iztgqrbnsg0 yellow house entrance with lanterns and potted plants. cozy inn entrance with lanterns yellow house entrance with lanterns and potted plants iztgqrbnsg0,2026-06-03T15:51:32.843Z
curb-appeal-landscaping-with-stone-pillars-a,curb-appeal-landscaping-with-stone-pillars,Curb Appeal Landscaping With Stone Pillars,Curb Appeal Landscaping Ideas,curb-appeal-landscaping-ideas,Curb Appeal Landscaping Ideas,curb-appeal-landscaping-ideas,A,Curb Appeal Landscaping With Stone Pillars: Hero Curb Appeal View,"See the full-property view for Curb Appeal Landscaping With Stone Pillars: rocks, gravel, boulders, stone borders, real American curb appeal, natural light, and practical front yard landscaping ideas. Curb Appeal Landscaping With Stone Pillars with entry markers, durable texture, and luxury front yard structure, realistic photography, and a Pinterest-ready front yard look.",Rock Landscaping; rock landscaping; gravel front yard; stone border; boulder landscaping; hero exterior; full property view; curb appeal view; front yard inspiration; front yard landscaping; stone pillar landscaping; curb appeal; Curb Appeal Landscaping Ideas; curb appeal landscaping stone pillars; rocks; gravel,"Wide exterior view, hero shot, full property view for Curb Appeal Landscaping With Stone Pillars, showing rocks, gravel, boulders around a realistic American home.",https://frontyardaura.com/blog/curb-appeal-landscaping-with-stone-pillars/,curb-appeal-landscaping-with-stone-pillars-pin-a-1tzli.jpg,https://frontyardaura.com/pins/curb-appeal-landscaping-with-stone-pillars-pin-a-1tzli.jpg,"Ultra realistic photorealistic DSLR vertical 2:3 Pinterest image, 1000x1500 composition, professional architectural photography of a real American home. Article match: ""Curb Appeal Landscaping With Stone Pillars"" in ""Curb Appeal Landscaping Ideas"", slug concept ""curb appeal landscaping stone pillars"", keywords ""front yard landscaping, stone pillar landscaping, curb appeal"". Scene: wide street-level architectural hero photograph showing the full property, driveway edge, walkway, porch, and complete landscape layout; this must read as a broad exterior establishing shot. The image must immediately communicate Rock Landscaping and must visibly include rocks, gravel, boulders, stone borders, real stone texture. Use natural daylight, believable American suburban architecture, real landscaping, real plant scale, authentic stone/soil/mulch/flower textures, magazine-quality curb appeal, no staged showroom look. Reserve clean readable negative space for a later overlay without covering the main landscaping subject; keep the most important yard feature away from the center title zone and bottom CTA zone. Do not render text into the base photo; add the overlay in post-production using the overlay fields.",FRONT YARD AURA,Curb Appeal Landscaping With Stone Pillars,Must-See Stone Ideas,"Premium Pinterest typography with strict mobile-safe layout: title max width 820px, 90px side padding, automatic font sizing, controlled line wrapping, and no text overflow outside the image. Use a light readability treatment only: subtle shadow, soft local panel behind title, and reduced dark overlay so the photo stays bright. Keep title and CTA inside safe margins and away from the core landscape detail. center title over calm sky, lawn, or facade negative space","Wide exterior view, hero shot, full property view","full American home exterior, front yard, entry path, foundation beds, street-facing curb appeal",Ultra realistic; photorealistic; DSLR photography; natural lighting; real American homes; real landscaping; real textures; professional architectural photography; Pinterest worthy; magazine quality.,Candidate only. Do not publish until scripts/generate-production-pins.mjs assigns quality_status=approved after strict image-source filtering.,approved,,rock-landscaping,"Rocks, boulders, or gravel visible",83,unsplash:photo-1778705286518-3f36744be571,photo-1778705286518-3f36744be571,photo 1778705286518 3f36744be571,unsplash-expanded-search,https://images.unsplash.com/photo-1778705286518-3f36744be571,stone house with blooming wisteria and dirt path stone house with blooming wisteria and dirt path zxcs4he9tmc stone house with blooming wisteria and dirt path stone house with blooming wisteria and dirt path zxcs4he9tmc,2026-06-04T18:25:57.613Z
curved-front-walkway-landscaping-ideas-a,curved-front-walkway-landscaping-ideas,Curved Front Walkway Landscaping Ideas,Walkway Landscaping Ideas,walkway-landscaping-ideas,Walkway Landscaping Ideas,walkway-landscaping-ideas,A,Curved Walkway Landscaping Ideas: Hero Curb Appeal View,"See the full-property view for Curved Front Walkway Landscaping Ideas: pavers, walkways, garden paths, entrance paths, real American curb appeal, natural light, and practical front yard landscaping ideas. Curved Walkway Landscaping Ideas with soft paths, layered beds, and welcoming entries, realistic photography, and polished Pinterest-ready curb appeal.",Walkway Landscaping; walkway landscaping; front path; paver walkway; entry path; hero exterior; full property view; curb appeal view; front yard inspiration; front yard landscaping; curved walkways; curb appeal; Walkway Landscaping Ideas; curved front walkway landscaping ideas; pavers; walkways,"Wide exterior view, hero shot, full property view for Curved Front Walkway Landscaping Ideas, showing pavers, walkways, garden paths around a realistic American home.",https://frontyardaura.com/blog/curved-front-walkway-landscaping-ideas/,curved-front-walkway-landscaping-ideas-pin-a-j6v4l.jpg,https://frontyardaura.com/pins/curved-front-walkway-landscaping-ideas-pin-a-j6v4l.jpg,"Ultra realistic photorealistic DSLR vertical 2:3 Pinterest image, 1000x1500 composition, professional architectural photography of a real American home. Article match: ""Curved Front Walkway Landscaping Ideas"" in ""Walkway Landscaping Ideas"", slug concept ""curved front walkway landscaping ideas"", keywords ""front yard landscaping, curved walkways, curb appeal"". Scene: wide street-level architectural hero photograph showing the full property, driveway edge, walkway, porch, and complete landscape layout; this must read as a broad exterior establishing shot. The image must immediately communicate Walkway Landscaping and must visibly include pavers, walkways, garden paths, entrance paths. Use natural daylight, believable American suburban architecture, real landscaping, real plant scale, authentic stone/soil/mulch/flower textures, magazine-quality curb appeal, no staged showroom look. Reserve clean readable negative space for a later overlay without covering the main landscaping subject; keep the most important yard feature away from the center title zone and bottom CTA zone. Do not render text into the base photo; add the overlay in post-production using the overlay fields.",FRONT YARD AURA,Curved Front Walkway Landscaping Ideas,Polished Entry Ideas,"Premium Pinterest typography with strict mobile-safe layout: title max width 820px, 90px side padding, automatic font sizing, controlled line wrapping, and no text overflow outside the image. Use a light readability treatment only: subtle shadow, soft local panel behind title, and reduced dark overlay so the photo stays bright. Keep title and CTA inside safe margins and away from the core landscape detail. center title over calm sky, lawn, or facade negative space","Wide exterior view, hero shot, full property view","full American home exterior, front yard, entry path, foundation beds, street-facing curb appeal",Ultra realistic; photorealistic; DSLR photography; natural lighting; real American homes; real landscaping; real textures; professional architectural photography; Pinterest worthy; magazine quality.,Candidate only. Do not publish until scripts/generate-production-pins.mjs assigns quality_status=approved after strict image-source filtering.,approved,,walkway,Walkway or path visible,83,unsplash:photo-1708500145765-ebcbc562fd0c,photo-1708500145765-ebcbc562fd0c,photo 1708500145765 ebcbc562fd0c,unsplash-expanded-search,https://images.unsplash.com/photo-1708500145765-ebcbc562fd0c,a house with a path leading to it a house with a path leading to it syd8mvndv0 a house with a path leading to it a house with a path leading to it syd8mvndv0,2026-06-04T18:25:57.613Z
