pin_id,article_slug,article_title,category,category_slug,board_name,board_slug,pin_variant,pin_title,pin_description,keywords,alt_text,destination_url,image_file,image_url,image_prompt,overlay_top,overlay_center,overlay_bottom,overlay_style,composition,visual_focus,quality_rules,compliance_notes,quality_status,quality_rejection_reasons,quality_rule_key,quality_rule_label,quality_score,source_signature,quality_source_id,quality_source_key,quality_source_type,quality_source_url,quality_source_text,quality_checked_at
brick-front-walkway-landscaping-ideas-a,brick-front-walkway-landscaping-ideas,Brick Front Walkway Landscaping Ideas,Walkway Landscaping Ideas,walkway-landscaping-ideas,Walkway Landscaping Ideas,walkway-landscaping-ideas,A,Brick Front Walkway Landscaping Ideas: Hero Curb Appeal View,"See the full-property view for Brick Front Walkway Landscaping Ideas: brick walkway or edging, pavers, walkways, garden paths, real American curb appeal, natural light, and practical front yard landscaping ideas. Brick Front Walkway Landscaping Ideas with classic paths, soft borders, and timeless entry character, natural light, and a polished Pinterest-ready look.",Walkway Landscaping; walkway landscaping; front path; paver walkway; entry path; hero exterior; full property view; curb appeal view; front yard inspiration; front yard landscaping; brick walkways; curb appeal; Walkway Landscaping Ideas; brick front walkway landscaping ideas; brick walkway or edging; pavers,"Wide exterior view, hero shot, full property view for Brick Front Walkway Landscaping Ideas, showing brick walkway or edging, pavers, walkways around a realistic American home.",https://frontyardaura.com/blog/brick-front-walkway-landscaping-ideas/,brick-front-walkway-landscaping-ideas-pin-a-zvf2b.jpg,https://frontyardaura.com/pins/brick-front-walkway-landscaping-ideas-pin-a-zvf2b.jpg,"Ultra realistic photorealistic DSLR vertical 2:3 Pinterest image, 1000x1500 composition, professional architectural photography of a real American home. Article match: ""Brick Front Walkway Landscaping Ideas"" in ""Walkway Landscaping Ideas"", slug concept ""brick front walkway landscaping ideas"", keywords ""front yard landscaping, brick walkways, curb appeal"". Scene: wide street-level architectural hero photograph showing the full property, driveway edge, walkway, porch, and complete landscape layout; this must read as a broad exterior establishing shot. The image must immediately communicate Walkway Landscaping and must visibly include brick walkway or edging, pavers, walkways, garden paths, entrance paths. Use natural daylight, believable American suburban architecture, real landscaping, real plant scale, authentic stone/soil/mulch/flower textures, magazine-quality curb appeal, no staged showroom look. Reserve clean readable negative space for a later overlay without covering the main landscaping subject; keep the most important yard feature away from the center title zone and bottom CTA zone. Do not render text into the base photo; add the overlay in post-production using the overlay fields.",FRONT YARD AURA,Brick Front Walkway Landscaping Ideas,Polished Entry Ideas,"Premium Pinterest typography with strict mobile-safe layout: title max width 820px, 90px side padding, automatic font sizing, controlled line wrapping, and no text overflow outside the image. Use a light readability treatment only: subtle shadow, soft local panel behind title, and reduced dark overlay so the photo stays bright. Keep title and CTA inside safe margins and away from the core landscape detail. center title over calm sky, lawn, or facade negative space","Wide exterior view, hero shot, full property view","full American home exterior, front yard, entry path, foundation beds, street-facing curb appeal",Ultra realistic; photorealistic; DSLR photography; natural lighting; real American homes; real landscaping; real textures; professional architectural photography; Pinterest worthy; magazine quality.,Candidate only. Do not publish until scripts/generate-production-pins.mjs assigns quality_status=approved after strict image-source filtering.,approved,,brick-walkway,Brick walkway visible,82,unsplash:photo-1666040625810-10a88a71892b,photo-1666040625810-10a88a71892b,photo 1666040625810 10a88a71892b,unsplash-search,https://images.unsplash.com/photo-1666040625810-10a88a71892b,a brick path with plants and a fence a brick path with plants and a fence 1s1jwe5 stk a brick path with plants and a fence a brick path with plants and a fence 1s1jwe5 stk,2026-06-03T15:51:32.843Z
budget-front-yard-curb-appeal-for-renters-a,budget-front-yard-curb-appeal-for-renters,Budget Front Yard Curb Appeal for Renters,Front Yard Landscaping On A Budget,front-yard-landscaping-on-a-budget,Front Yard Landscaping On A Budget,front-yard-landscaping-on-a-budget,A,Budget Front Yard Curb Appeal for Renters: Hero Curb Appeal View,"See the full-property view for Budget Front Yard Curb Appeal for Renters: budget-friendly landscaping, simple materials, clean edging, affordable curb appeal, real American curb appeal, natural light, and practical front yard landscaping ideas. Budget Front Yard Curb Appeal for Renters with portable planters, temporary upgrades, and no-permanent-change style, natural light, and a polished Pinterest-ready look.",Budget Landscaping; budget front yard; cheap curb appeal; affordable landscaping; diy landscaping; hero exterior; full property view; curb appeal view; front yard inspiration; front yard landscaping; renter-friendly curb appeal; curb appeal; Front Yard Landscaping On A Budget; budget front yard curb appeal renters; budget-friendly landscaping; simple materials,"Wide exterior view, hero shot, full property view for Budget Front Yard Curb Appeal for Renters, showing budget-friendly landscaping, simple materials, clean edging around a realistic American home.",https://frontyardaura.com/blog/budget-front-yard-curb-appeal-for-renters/,budget-front-yard-curb-appeal-for-renters-pin-a-1jl64.jpg,https://frontyardaura.com/pins/budget-front-yard-curb-appeal-for-renters-pin-a-1jl64.jpg,"Ultra realistic photorealistic DSLR vertical 2:3 Pinterest image, 1000x1500 composition, professional architectural photography of a real American home. Article match: ""Budget Front Yard Curb Appeal for Renters"" in ""Front Yard Landscaping On A Budget"", slug concept ""budget front yard curb appeal renters"", keywords ""front yard landscaping, renter-friendly curb appeal, curb appeal"". Scene: wide street-level architectural hero photograph showing the full property, driveway edge, walkway, porch, and complete landscape layout; this must read as a broad exterior establishing shot. The image must immediately communicate Budget Landscaping and must visibly include budget-friendly landscaping, simple materials, clean edging, affordable curb appeal. Use natural daylight, believable American suburban architecture, real landscaping, real plant scale, authentic stone/soil/mulch/flower textures, magazine-quality curb appeal, no staged showroom look. Reserve clean readable negative space for a later overlay without covering the main landscaping subject; keep the most important yard feature away from the center title zone and bottom CTA zone. Do not render text into the base photo; add the overlay in post-production using the overlay fields.",FRONT YARD AURA,Budget Front Yard Curb Appeal for Renters,Budget Friendly Ideas,"Premium Pinterest typography with strict mobile-safe layout: title max width 820px, 90px side padding, automatic font sizing, controlled line wrapping, and no text overflow outside the image. Use a light readability treatment only: subtle shadow, soft local panel behind title, and reduced dark overlay so the photo stays bright. Keep title and CTA inside safe margins and away from the core landscape detail. center title over calm sky, lawn, or facade negative space","Wide exterior view, hero shot, full property view","full American home exterior, front yard, entry path, foundation beds, street-facing curb appeal",Ultra realistic; photorealistic; DSLR photography; natural lighting; real American homes; real landscaping; real textures; professional architectural photography; Pinterest worthy; magazine quality.,Candidate only. Do not publish until scripts/generate-production-pins.mjs assigns quality_status=approved after strict image-source filtering.,approved,,front-yard-exterior,Front yard and exterior visible,83,unsplash:photo-1664988851452-db5b571070cd,photo-1664988851452-db5b571070cd,photo 1664988851452 db5b571070cd,unsplash-expanded-search,https://images.unsplash.com/photo-1664988851452-db5b571070cd,a house with a grass yard a house with a grass yard l3c11hsdm34 a house with a grass yard a house with a grass yard l3c11hsdm34,2026-06-04T18:25:57.613Z
budget-front-yard-flower-bed-makeover-a,budget-front-yard-flower-bed-makeover,Budget Front Yard Flower Bed Makeover Ideas,Front Yard Landscaping On A Budget,front-yard-landscaping-on-a-budget,Front Yard Landscaping On A Budget,front-yard-landscaping-on-a-budget,A,Budget Flower Bed Makeover Ideas: Hero Curb Appeal View,"See the full-property view for Budget Front Yard Flower Bed Makeover Ideas: real flower beds, seasonal flowers, garden borders, layered planting, real American curb appeal, natural light, and practical front yard landscaping ideas. Budget Flower Bed Makeover Ideas with fresh mulch, repeated flowers, and tidy structure, realistic photography, and polished Pinterest-ready curb appeal.",Flower Beds; flower bed ideas; seasonal flowers; garden border; front yard flowers; hero exterior; full property view; curb appeal view; front yard inspiration; front yard landscaping; affordable flower beds; curb appeal; Front Yard Landscaping On A Budget; budget front yard flower bed makeover; real flower beds; garden borders,"Wide exterior view, hero shot, full property view for Budget Front Yard Flower Bed Makeover Ideas, showing real flower beds, seasonal flowers, garden borders around a realistic American home.",https://frontyardaura.com/blog/budget-front-yard-flower-bed-makeover/,budget-front-yard-flower-bed-makeover-pin-a-165wf.jpg,https://frontyardaura.com/pins/budget-front-yard-flower-bed-makeover-pin-a-165wf.jpg,"Ultra realistic photorealistic DSLR vertical 2:3 Pinterest image, 1000x1500 composition, professional architectural photography of a real American home. Article match: ""Budget Front Yard Flower Bed Makeover Ideas"" in ""Front Yard Landscaping On A Budget"", slug concept ""budget front yard flower bed makeover"", keywords ""front yard landscaping, affordable flower beds, curb appeal"". Scene: wide street-level architectural hero photograph showing the full property, driveway edge, walkway, porch, and complete landscape layout; this must read as a broad exterior establishing shot. The image must immediately communicate Flower Beds and must visibly include real flower beds, seasonal flowers, garden borders, layered planting. Use natural daylight, believable American suburban architecture, real landscaping, real plant scale, authentic stone/soil/mulch/flower textures, magazine-quality curb appeal, no staged showroom look. Reserve clean readable negative space for a later overlay without covering the main landscaping subject; keep the most important yard feature away from the center title zone and bottom CTA zone. Do not render text into the base photo; add the overlay in post-production using the overlay fields.",FRONT YARD AURA,Budget Front Yard Flower Bed Makeover Ideas,Budget Friendly Ideas,"Premium Pinterest typography with strict mobile-safe layout: title max width 820px, 90px side padding, automatic font sizing, controlled line wrapping, and no text overflow outside the image. Use a light readability treatment only: subtle shadow, soft local panel behind title, and reduced dark overlay so the photo stays bright. Keep title and CTA inside safe margins and away from the core landscape detail. center title over calm sky, lawn, or facade negative space","Wide exterior view, hero shot, full property view","full American home exterior, front yard, entry path, foundation beds, street-facing curb appeal",Ultra realistic; photorealistic; DSLR photography; natural lighting; real American homes; real landscaping; real textures; professional architectural photography; Pinterest worthy; magazine quality.,Candidate only. Do not publish until scripts/generate-production-pins.mjs assigns quality_status=approved after strict image-source filtering.,approved,,flower-bed,Flower bed or flowers visible,83,unsplash:photo-1747297646316-9dc79a1f690b,photo-1747297646316-9dc79a1f690b,photo 1747297646316 9dc79a1f690b,unsplash-expanded-search,https://images.unsplash.com/photo-1747297646316-9dc79a1f690b,a house exterior is surrounded by beautiful flowers. a house exterior is surrounded by beautiful flowers krpyywxzqz8 a house exterior is surrounded by beautiful flowers. a house exterior is surrounded by beautiful flowers krpyywxzqz8,2026-06-04T18:25:57.613Z
budget-front-yard-ideas-with-cheap-border-plants-a,budget-front-yard-ideas-with-cheap-border-plants,Budget Front Yard Ideas With Cheap Border Plants,Front Yard Landscaping On A Budget,front-yard-landscaping-on-a-budget,Front Yard Landscaping On A Budget,front-yard-landscaping-on-a-budget,A,Budget Front Yard Ideas With Cheap Border Plants: Hero Curb Appeal View,"See the full-property view for Budget Front Yard Ideas With Cheap Border Plants: budget-friendly landscaping, simple materials, clean edging, affordable curb appeal, real American curb appeal, natural light, and practical front yard landscaping ideas. Budget Front Yard Ideas With Cheap Border Plants with affordable repetition, clean edges, and fuller walkway beds, natural light, and a polished Pinterest-ready front yard look.",Budget Landscaping; budget front yard; cheap curb appeal; affordable landscaping; diy landscaping; hero exterior; full property view; curb appeal view; front yard inspiration; front yard landscaping; cheap border plants; curb appeal; Front Yard Landscaping On A Budget; budget front yard ideas cheap border plants; budget-friendly landscaping; simple materials,"Wide exterior view, hero shot, full property view for Budget Front Yard Ideas With Cheap Border Plants, showing budget-friendly landscaping, simple materials, clean edging around a realistic American home.",https://frontyardaura.com/blog/budget-front-yard-ideas-with-cheap-border-plants/,budget-front-yard-ideas-with-cheap-border-plants-pin-a-1gh2t.jpg,https://frontyardaura.com/pins/budget-front-yard-ideas-with-cheap-border-plants-pin-a-1gh2t.jpg,"Ultra realistic photorealistic DSLR vertical 2:3 Pinterest image, 1000x1500 composition, professional architectural photography of a real American home. Article match: ""Budget Front Yard Ideas With Cheap Border Plants"" in ""Front Yard Landscaping On A Budget"", slug concept ""budget front yard ideas cheap border plants"", keywords ""front yard landscaping, cheap border plants, curb appeal"". Scene: wide street-level architectural hero photograph showing the full property, driveway edge, walkway, porch, and complete landscape layout; this must read as a broad exterior establishing shot. The image must immediately communicate Budget Landscaping and must visibly include budget-friendly landscaping, simple materials, clean edging, affordable curb appeal. Use natural daylight, believable American suburban architecture, real landscaping, real plant scale, authentic stone/soil/mulch/flower textures, magazine-quality curb appeal, no staged showroom look. Reserve clean readable negative space for a later overlay without covering the main landscaping subject; keep the most important yard feature away from the center title zone and bottom CTA zone. Do not render text into the base photo; add the overlay in post-production using the overlay fields.",FRONT YARD AURA,Budget Front Yard Ideas With Cheap Border Plants,Budget Friendly Ideas,"Premium Pinterest typography with strict mobile-safe layout: title max width 820px, 90px side padding, automatic font sizing, controlled line wrapping, and no text overflow outside the image. Use a light readability treatment only: subtle shadow, soft local panel behind title, and reduced dark overlay so the photo stays bright. Keep title and CTA inside safe margins and away from the core landscape detail. center title over calm sky, lawn, or facade negative space","Wide exterior view, hero shot, full property view","full American home exterior, front yard, entry path, foundation beds, street-facing curb appeal",Ultra realistic; photorealistic; DSLR photography; natural lighting; real American homes; real landscaping; real textures; professional architectural photography; Pinterest worthy; magazine quality.,Candidate only. Do not publish until scripts/generate-production-pins.mjs assigns quality_status=approved after strict image-source filtering.,approved,,front-yard-exterior,Front yard and exterior visible,83,unsplash:photo-1755914305030-bfc5c0196d76,photo-1755914305030-bfc5c0196d76,photo 1755914305030 bfc5c0196d76,unsplash-expanded-search,https://images.unsplash.com/photo-1755914305030-bfc5c0196d76,snowy path leads to a house by the bright blue sea. cuva snowy path leads to a house by the bright blue sea wv 9olus6pi snowy path leads to a house by the bright blue sea. cuva snowy path leads to a house by the bright blue sea wv 9olus6pi,2026-06-04T18:25:57.613Z
budget-front-yard-ideas-with-divided-perennials-a,budget-front-yard-ideas-with-divided-perennials,Budget Front Yard Ideas With Divided Perennials,Front Yard Landscaping On A Budget,front-yard-landscaping-on-a-budget,Front Yard Landscaping On A Budget,front-yard-landscaping-on-a-budget,A,Budget Front Yard Ideas With Divided Perennials: Hero Curb Appeal View,"See the full-property view for Budget Front Yard Ideas With Divided Perennials: real flower beds, seasonal flowers, garden borders, layered planting, real American curb appeal, natural light, and practical front yard landscaping ideas. Budget Front Yard Ideas With Divided Perennials with free plant expansion, fuller beds, and practical savings, natural light, and a polished Pinterest-ready look.",Flower Beds; flower bed ideas; seasonal flowers; garden border; front yard flowers; hero exterior; full property view; curb appeal view; front yard inspiration; front yard landscaping; divided perennial landscaping; curb appeal; Front Yard Landscaping On A Budget; budget front yard ideas divided perennials; real flower beds; garden borders,"Wide exterior view, hero shot, full property view for Budget Front Yard Ideas With Divided Perennials, showing real flower beds, seasonal flowers, garden borders around a realistic American home.",https://frontyardaura.com/blog/budget-front-yard-ideas-with-divided-perennials/,budget-front-yard-ideas-with-divided-perennials-pin-a-1ugmm.jpg,https://frontyardaura.com/pins/budget-front-yard-ideas-with-divided-perennials-pin-a-1ugmm.jpg,"Ultra realistic photorealistic DSLR vertical 2:3 Pinterest image, 1000x1500 composition, professional architectural photography of a real American home. Article match: ""Budget Front Yard Ideas With Divided Perennials"" in ""Front Yard Landscaping On A Budget"", slug concept ""budget front yard ideas divided perennials"", keywords ""front yard landscaping, divided perennial landscaping, curb appeal"". Scene: wide street-level architectural hero photograph showing the full property, driveway edge, walkway, porch, and complete landscape layout; this must read as a broad exterior establishing shot. The image must immediately communicate Flower Beds and must visibly include real flower beds, seasonal flowers, garden borders, layered planting. Use natural daylight, believable American suburban architecture, real landscaping, real plant scale, authentic stone/soil/mulch/flower textures, magazine-quality curb appeal, no staged showroom look. Reserve clean readable negative space for a later overlay without covering the main landscaping subject; keep the most important yard feature away from the center title zone and bottom CTA zone. Do not render text into the base photo; add the overlay in post-production using the overlay fields.",FRONT YARD AURA,Budget Front Yard Ideas With Divided Perennials,Budget Friendly Ideas,"Premium Pinterest typography with strict mobile-safe layout: title max width 820px, 90px side padding, automatic font sizing, controlled line wrapping, and no text overflow outside the image. Use a light readability treatment only: subtle shadow, soft local panel behind title, and reduced dark overlay so the photo stays bright. Keep title and CTA inside safe margins and away from the core landscape detail. center title over calm sky, lawn, or facade negative space","Wide exterior view, hero shot, full property view","full American home exterior, front yard, entry path, foundation beds, street-facing curb appeal",Ultra realistic; photorealistic; DSLR photography; natural lighting; real American homes; real landscaping; real textures; professional architectural photography; Pinterest worthy; magazine quality.,Candidate only. Do not publish until scripts/generate-production-pins.mjs assigns quality_status=approved after strict image-source filtering.,approved,,front-yard-exterior,Front yard and exterior visible,83,unsplash:photo-1634791809040-290d9ff5aec7,photo-1634791809040-290d9ff5aec7,photo 1634791809040 290d9ff5aec7,unsplash-expanded-search,https://images.unsplash.com/photo-1634791809040-290d9ff5aec7,a stone path leading to a gray house a stone path leading to a gray house 5j9wdinblh8 a stone path leading to a gray house a stone path leading to a gray house 5j9wdinblh8,2026-06-04T18:25:57.613Z
